location,Nationality,job_Category,EmploymentType,gender,Experience_years,min Education,Name,KeySkills
Kabul,National,Business,Full Time,Male,8 years,BA,Position Title: Admin Finance Manager,
Kabul,National,Health Care,Part Time,Any,6 years,MA,"Position Title: Gynecologist, ultrasonologist",
Kabul,Any,Health Care,Full Time,Male,2 years,MA,Position Title: General Physician Specialist,
Kabul,National,Business,Full Time,Male,3-5 years,BA,Position Title: Accounting Supervisor,
Khost,National,Health Care,Full Time,Any,2-3 years,BA,Position Title: Orthopedic Surgeon (Share-based),Excellent patient management skills and patient-oriented approach
Kandahar,National,Other,Full Time,Male,2  years,BA,Position Title: Lecturers for  Computer Science Faculty,At least two years teaching experience in the relevant field. 
Kabul,National,Construction,Full Time,Male,7 years,BA,Position Title: Proposal Writer ( Civil Engineer ),
Herat,National,Business,Full Time,Any,3 years,BA,Position Title: Digital Marketer (Herat Local Recruitment),
Kabul,National,Program/Project,Full Time,Any,3-5 years,BA,Position Title: Last Mile Assurance Officer,
Kabul,National,Hospitality,Full Time,Any,7 years,BA,Position Title: Event Manager,
Kabul,National,Sales,Full Time,Male,4-5 years,BA,Position Title: Marketing Manager,
Panjshir,National,Health Care,Full Time,Female,1 year,MD,Position Title: Gynecologist (Re Announced),
Zabul,National,Health Care,Full Time,Female,2 years,BA,Position Title: Midwife Activity Manager (Re Announced),
Kabul,National,Health Care,Full Time,Any,3 years,BA,Position Title: Dermatologist,
Kabul,Any,Other,Part Time,Any,2 years,BA,Position Title: Marketing Manager,
Kabul,National,Business,Full Time,Any,5-7 years,BA,Position Title: Finance and Admin Manager,
Kabul,National,Security,Full Time,Male,4 year,HS,Position Title: Security Officer,
Badakhshan,National,Research,Full Time,Any,1 year,BA,Position Title: Data Collectors (couples),
Kabul,National,Business,Full Time,Male,3-4 years,BA,Position Title: Field Manager,
Kabul,National,Business,Full Time,Male,3-year,BA,Position Title: Internal Audit Officer,
Herat,National,Construction,Full Time,Any,6 years,BA,Position Title: Project Manager,
Herat,National,Construction,Full Time,Any,5 years,BA,Position Title: Quality Assurance / Quality Control Engineer,
Kabul,National,Legal,Full Time,Male,3 years,MA,Position Title: Associate Attorney,
Herat,National,Banking/Accounting,Full Time,Male,2-3 years,BA,Position Title: Islamic Investment Officer,
Nangarhar,National,Education,Full Time,Male,3 years,BA,Position Title: Lecturer for HRM and Finance Subjects-Faculty of Economics,Language Skills:ÿ Fluency in English Pushto and Dari
Kabul,National,Security,Full Time,Male,5 years,BA,Position Title: HR Manager,
Kabul,National,Security,Full Time,Male,5 years,BA,Position Title: Proposal Writer for Security Company,
Kabul,National,Business,Full Time,Male,5 years,BA,"Position Title: HR & RSM (Recruitment, selection & Matriculation) Manager",
Kabul,National,Other,Full Time,Male,3 years,BA,Position Title: Admin Assistant for wash unit,Proven ability to engage discretely and tactfully with internal and external stakeholders.
Kabul,National,Program/Project,Full Time,Any,5 years,BA,Position Title: Program Manager,
Kabul,National,Education,Full Time,Female,3-4 years,BA,Position Title: Marketing Officer and Study Visa Filling Officer (Female),Provide students with information about admission process and answer any questions they have
Balkh,National,Engineering,Full Time,Any,10 years,BA,Position Title: Building Supervision Engineer,
Takhar,National,Education,Full Time,Any,4 years,BA,Position Title: Master Trainer,Strong oral and written communication skill in Pashto; skills in Dari will also be an asset.
Kunduz,National,Education,Full Time,Any,4 years,HS,Position Title: Community Mobilizer,"Strong oral and written communication skill in Pashto and Dari, skills in English will also be an asset."
Kunduz,National,Education,Full Time,Any,4 years,HS,Position Title: Community Mobilizer,"Strong oral and written communication skill in Pashto and Dari, skills in English will also be an asset."
Kunduz,National,Education,Full Time,Any,4 years,HS,Position Title: Community Mobilizer,"Strong oral and written communication skill in Pashto and Dari, skills in English will also be an asset."
Kunduz,National,Education,Full Time,Any,4 years,BA,Position Title: Master Trainer,Strong oral and written communication skill in Pashto; skills in Dari will also be an asset.
Kabul,National,Education,Full Time,Male,2 years,MA,Position Title: Lecturership BCS & BBA,
Kabul,National,Education,Full Time,Male,10 years,MA,Position Title: University Chancellor,
Kabul,National,Other,Full Time,Male,7 Year,BA,Position Title: Quantity Survey Engineer,Qualification
Kabul,National,Hospitality,Full Time,Male,5 years,BA,Position Title: Guest House Manager and Events Coordinator,
Kabul,National,Information Technology,Full Time,Any,2 years,BA,Position Title: Application Developer,
Kabul,National,Business,Full Time,Any,5years,BA,"Position Title: Director, Human Resources",Excellent verbal and written communication skills.
Kabul,National,Other,Full Time,Any,7 years,BA,"Position Title: Specialist , HVC segment",
Kabul,National,Purchasing-Procurement,Full Time,Any,7 years,BA,Position Title: National Senior Procurement Specialist,
Kabul,National,Purchasing-Procurement,Full Time,Any,7 years,BA,Position Title: National Senior Procurement Specialist - WERP Project,
Kabul,National,Program/Project,Full Time,Any,5 years,BA,Position Title: Sr. Database Manager and M&E Specialist,
Kabul,National,Health Care,Full Time,Any,2-3 years,BA,Position Title: Finance Officer,Proficiency in complex accounting systems and good level MS Excel skills.
Khost,National,Security,Full Time,Any,1-2 years,HS,Position Title: Watchman,
Khost,National,Security,Full Time,Any,1-2 years,HS,Position Title: Watchman,
Khost,National,Security,Full Time,Any,1-2 years,HS,Position Title: Watchman,
Badghis,National,Health Care,Full Time,Male,5 years,MD,Position Title: Provincial Officer,
Kabul,National,Business,Full Time,Any,7 years,BA,Position Title: MARKETING MANAGER,
Khost,National,Business,Full Time,Any,3-5 years,BA,Position Title: Project Manager (Child Protection),
Khost,National,Business,Full Time,Any,3-5 years,BA,Position Title: Psycho Social Support (PSS) Counsellor,
Khost,National,Other,Full Time,Any,3-5 years,BA,Position Title: Case Management Officer,
Kabul,Any,Education,Part Time,Any,1-3 years,BA,"Position Title: School Teachers, Cambridge Subjects (Computer, Chemistry, Mathematics, Biology, Physics, English) Headmistress & Cambridge Computer Teacher(Balkh)",
Kabul,National,Information Technology,Full Time,Any,2 year,BA,Position Title: ICT Officer (Re Announced),
Kabul,National,Research,Full Time,Any,1 year,HS,Position Title: Data Clerk (Quantitative and Qualitative),
Herat,National,Program/Project,Full Time,Any,4 years,None,Position Title: Senior Programme Associate (In replacement Capacity with Lien),
Bamian,National,Health Care,Full Time,Any,3 years,BA,Position Title: Pharmacy Officer,
Logar,National,Program/Project,Full Time,Any,3 years,MA,Position Title: PMEAL Officer,
Nangarhar,National,Education,Full Time,Male,2 years,BA,Position Title: The Results Manager,
Nangarhar,National,Program/Project,Full Time,Any,7 years,MA,Position Title: Senior TB Advisor,"Seven plus (7+) years of professional experience working in public health and TB in Afghanistan essential. Previous experience in similar positions. Recognized expertise in DS - TB and/or DR-TB programming, at the country level is essential."
Kabul,Any,Business,Full Time,Male,5 years,MA,Position Title: Deputy Director Operations,
Kabul,National,Service,Full Time,Male,10 years,MA,Position Title: Hiring of General Manager for Paaeez Continental,
Faryab,National,Health Care,Full Time,Any,5 years,MD,Position Title: project manager,
Faryab,National,Business,Full Time,Any,3 years,BA,Position Title: Admin/Finance Officer,
Kabul,National,Other,Full Time,Any,5-7 years,MA,Position Title: Internal Audit Senior Officer,Good training opportunities to enhance employees skills
Kabul,National,Business,Full Time,Any,5 years,MA,Position Title: Finance Coordinator (Treasury) Re-Announced (Re Announced),Good training opportunities to enhance employees skills
Faryab,National,Health Care,Full Time,Any,3 years,BA,Position Title: Participants representative,
Bamian,National,Security,Full Time,Male,5 years,BA,Position Title: Project Risk Manager  (PRM),Outlook
Kunar,National,Program/Project,Full Time,Any,5years,BA,Position Title: Economic Recovery Officer (Engineer) (Re Announced),"A minimum of five years of experience with INGOs, NGOs, construction companies, and government projects."
Zabul,National,Program/Project,Full Time,Any,2 year,BA,Position Title: ICLA Technical Assistant,"Provide legal information, counseling and assistance to displaced affected people in accordance with the ICLA strategy, project documents, and applicable laws and procedures."
Kabul,National,Health Care,Full Time,Any,10 years,BA,Position Title: Procurement Manager,
Ghazni,National,Program/Project,Full Time,Female,2 years,BA,Position Title: Protection Psychosocial Support Officer (Female Only) (168802),"At least 2 years of work experience in psychological/psychosocial counseling, preferably with IDPs/refugees/returnees."
Herat,National,Sales,Full Time,Any,3 years,BA,Position Title: Sales Executive,
Ghazni,National,Program/Project,Full Time,Female,2 years,BA,Position Title: Protection Officer ?caseworker? Ghazni (Female Only),"Minimum 2 years of Working experience with INGOs/NGOs in the same or similar roles (protection officer, social worker, etc)."
Kabul,National,Program/Project,Full Time,Female,2 years,BA,Position Title: Protection Officer ?Case Worker? (Female Only) (168806),"At least 2 years of working experience with INGOs/NGOs in the same or similar roles (protection officer, social worker, etc.)."
Oruzgan,National,Business,Full Time,Any,4 years,BA,Position Title: Finance Officer-UZG,Total 4 years of experience would be required
Bamian,National,Other,Full Time,Any,2 years,BA,Position Title: Hygiene promotor,
Laghman,National,Other,Full Time,Any,5 years,BA,Position Title: Project Officer,
Nangarhar,National,Other,Full Time,Any,2 years,BA,Position Title: Admin & Finance Assistant,Knowledge of MS Office and good communication skill is necessary
Farah,National,Business,Full Time,Any,2 year,BA,Position Title: Logistic Officer FRH,
Bamian,National,Other,Full Time,Any,2 years,BA,Position Title: Admin & Procurement Assistant,Knowledge of MS Office and good communication skill is necessary
Balkh,National,Other,Full Time,Any,5years,BA,Position Title: Human Resource Officer,
Kabul,National,Program/Project,Full Time,Any,7 years,BA,Position Title: Senior Program Specialist,"Excellent Writing Skills: The ability to craft clear, concise, and compelling applications/proposals is critical to securing funding for the organization. He/she should be able to write in a variety of styles, including technical, persuasive, and narrative, depending on the requirements of the proposal."
Baghlan,National,Health Care,Full Time,Any,3-4 years,BA,Position Title: Project Monitoring Officer,
Kabul,National,Program/Project,Full Time,Any,4 years,MA,Position Title: Lobby & Advocacy Expert,Ability to work with a diverse group of colleagues to achieve results in a responsible and collaborative manner.
Kabul,National,Agriculture,Full Time,Any,15 years,BA,Position Title: Deputy Chief of Party-Technical (Re Announced),
Kabul,National,Business,Full Time,Any,5-7 years,BA,Position Title: Finance Director,
Sar-e Pol,National,Business,Full Time,Any,2  years,BA,Position Title: Finance Assistant,
Kabul,National,Communication,Full Time,Any,5 years,BA,Position Title: Communication Specialist,Results Focus
Kabul,Any,Business,Full Time,Any,5years,BA,Position Title: Project Manager,
Kabul,National,Business,Full Time,Any,3 years,BA,Position Title: District Coordinator,
Kabul,National,Business,Full Time,Any,3 years,BA,Position Title: Community Development Facilitator (CDF),
Nangarhar,National,Program/Project,Full Time,Any,3 years,BA,Position Title: Trainer,
Kabul,National,Education,Full Time,Any,5-10 years,MA,Position Title: Principal High School  ,Work with teachers to create teaching schedules.
Balkh,Any,Education,Part Time,Any,1-3 years,BA,"Position Title: School Teachers, Cambridge Subject: (Computer), Maref Subjects:(History, Geography) Maref subject:(Dari :for Kabul location)",
Kabul,National,Program/Project,Full Time,Any,5 years,MA,Position Title: Deputy Research Manager,
Kabul,National,Other,Full Time,Any,3 years,MA,Position Title: Aviation Officer (NOB)- UNHAS- Kabul,At least three (3) years of postgraduate professional experience in a similar field.
Kandahar,National,Engineering,Full Time,Any,3 years,BA,Position Title: Site Engineer,
Kabul,National,Other,Full Time,Any,1 Year,MA,Position Title: Aviation Officer ( NOA)- UNHAS- Kabul,At least one (1) year of postgraduate professional experience
Kapisa,National,Education,Full Time,Female,1-3 years,BA,Position Title: Master Trainer- Only Famele,
Kabul,National,Program/Project,Full Time,Any,5 years,BA,Position Title: Software Developer (Consultant) for developing WASH MIS (Afghan Nationals Only),
Kabul,National,Engineering,Full Time,Any,7 years,BA,Position Title: Project Manager (Re Announced),"Certification in Project Management (PRINCE2, PMP, etc.) is an asset."
Kabul,National,Program/Project,Full Time,Any,5 years,BA,Position Title: Program Manager,
Nangarhar,National,Other,Full Time,Any,5years,HS,"Position Title: POLITICAL AFFAIRS ASSISTANT, G5",
Kabul,National,Other,Full Time,Any,5 years,HS,"Position Title: ADMINISTRATIVE ASSISTANT, G5",
Herat,National,Health Care,Full Time,Male,2-3 years,BA,Position Title: Psychosocial Counselor,
Kabul,National,Business,Full Time,Any,4 years,VD,Position Title: Administration Associate,
Helmand,National,Agriculture,Full Time,Male,4 years,BA,Position Title: Agriculture Specialist-Multiple,
Logar,National,Health Care,Full Time,Male,2 years,BA,Position Title: Surgeon Specialist  ,
Helmand,National,Agriculture,Full Time,Male,4 years,BA,Position Title: Complaint Officer-Multiple,
Herat,National,Other,Full Time,Any,2 years,BA,"Position Title: ASSISTANT ADMINISTRATIVE OFFICER, NOA",
Paktia,National,Health Care,Full Time,Female,1 year,HS,Position Title: HSCs Health and Hygiene Promotor,
Logar,National,Program/Project,Full Time,Male,5 years,MD,Position Title: Project provincial supervisor (Re Announced),
Helmand,National,Agriculture,Full Time,Male,3 years,BA,Position Title: Extension Worker-Multiple,
Kabul,National,Other,Full Time,Any,2  years,MD,Position Title: Nutrition Officer,
Helmand,National,Agriculture,Full Time,Male,2-3 years,BA,Position Title: Feedback and complaint mechanism officer-Multiple,"Ability to acquire, retrieve, and obtain information from different resources."
Kabul,National,Other,Full Time,Female,2  years,BA,Position Title: Female Nutrition Nurse,
Paktia,National,Health Care,Full Time,Female,1 year,VD,Position Title: HSCs Female Nurse/Vaccinator,
Badakhshan,National,Engineering,Full Time,Any,4 years,BA,Position Title: Architecture and Design Engineer,Bachelors degree on architecture
Helmand,National,Agriculture,Full Time,Female,3 years,BA,Position Title: Gender/PSEA Officer-Multiple,
Badakhshan,National,Program/Project,Full Time,Any,4 years,BA,Position Title: Livestock Technical Officer,Bachelors degree Veterinary sciences or relevant field
Badakhshan,National,Program/Project,Full Time,Any,3 years,BA,Position Title: Market Development Trainer,"Market development trainer is required to have bachelors degree in marketing, business or a related fields."
Helmand,National,Agriculture,Full Time,Male,2-4 years,BA,Position Title: Livelihood Officer- Multiple,
Kabul,National,Business,Full Time,Any,7 years,MA,Position Title: Senior Operations Officer,Seven-plus years of progressive experience managing operations. Including four (4) years of management experience
Kandahar,National,Other,Full Time,Any,2 years,BA,Position Title: Radio Operator (Re Announced),Ensure that messages are well copied/passed to all people concerned and records the messages on the radio logbook.
Badakhshan,National,Program/Project,Full Time,Any,3 years,BA,Position Title: NRM Technical Assistant,Bachelors degree on agriculture
Ghazni,National,Program/Project,Full Time,Any,5years,BA,Position Title: Regional Program Coordinator,"Bachelors degree on Agriculture, or Horticulture/ Livestock"
Helmand,National,Agriculture,Full Time,Male,2 years,BA,Position Title: Surveyor-Multiple,Previous experience as a surveyor or in a similar role
Kabul,National,Information Technology,Full Time,Any,8 years,BA,Position Title: Senior Manager Transport (Transmission Planning),
Kabul,National,Business,Full Time,Female,5 years,MA,Position Title: Senior Finance Officer (Financial Reporting & Compliance),Willingness to travel and work under difficult conditions.
Balkh,National,Business,Full Time,Any,2 years,BA,Position Title: Video Editing and Social Media Officer ? Remote Work,
Faryab,National,Program/Project,Full Time,Any,3 years,BA,Position Title: Construction Engineer,Bachelor degree on civil engineering
Kabul,National,Other,Full Time,Any,3 years,MA,Position Title: Health Coordinator,
Faryab,National,Program/Project,Full Time,Any,3 years,BA,Position Title: Market development Trainer,"Market development trainer is required to have bachelors degree in marketing, business or a related field."
Faryab,National,Program/Project,Full Time,Any,3 years,BA,Position Title: NRM & DRR Trainer,"BSc degree in agriculture/DRR or equivalent qualification including Agronomy, Horticulture, animal husbandry"
Faryab,National,Program/Project,Full Time,Any,3 years,BA,Position Title: Agriculture and Livelihood Officer,"BSc degree in agriculture or equivalent qualification including Agronomy, Horticulture, animal husbandry."
Paktia,National,Health Care,Full Time,Female,2 years,BA,Position Title: Female FATP Nurse (Only Paktia Residents),
Daikondi,National,Business,Full Time,Any,3 years,BA,Position Title: Admin & IT assistant,Computer literacy in Microsoft Excel and Word is absolutely essential.
Daikondi,National,Business,Full Time,Any,3 years,BA,Position Title: Finance Assistant,Bachelor of Business Administration with Specialization in Finance
Daikondi,National,Program/Project,Full Time,Any,2-3 years,BA,Position Title: M&E Assistant,Bachelors degree in relevant disciplines.
Balkh,National,Business,Full Time,Any,6 years,BA,Position Title: Operations Officer,
Daikondi,National,Program/Project,Full Time,Any,4 years,BA,Position Title: Agriculture and Livestock Officer,Bachelors degree Veterinary sciences or relevant field
Daikondi,National,Program/Project,Full Time,Any,3 years,BA,Position Title: Construction Site Engineer,Bachelor degree on civil engineering
Daikondi,National,Program/Project,Full Time,Any,3 years,BA,Position Title: DRR Trainer,BSc degree in agriculture/DRR or equivalent qualification
Kabul,National,Business,Full Time,Male,1 year,BA,Position Title: Counsellor,
Kabul,National,Program/Project,Full Time,Any,3-5 years,BA,Position Title: Project Manager,"Minimum 3-5 years experience at a similar level managing an agribusiness, livelihoods, and/or agriculture projects with special focus on women empowerment and other community base social empowerment projects."
Nangarhar,National,Program/Project,Full Time,Any,3 years,HS,Position Title: Project Clerk (M&E),"High school diploma and/or university degree or equivalent diploma in social sciences, development, Information Management, or any other related field."
Kabul,National,Business,Full Time,Any,3-5 years,BA,Position Title: Business Development Officer,
Kabul,Any,Business,Full Time,Male,5 years,BA,Position Title: Assistant Manager Operations,
Takhar,National,Security,Full Time,Any,5years,BA,Position Title: Security and Humanitarian Access Coordinator,
Daikondi,National,Program/Project,Full Time,Any,3 years,BA,Position Title: NRM Assistant,"BSc degree in agriculture or equivalent qualification including Agronomy, Horticulture, animal husbandry"
Daikondi,National,Business,Full Time,Any,1  year,HS,Position Title: Office Cleaner,High school diploma or equivalent is advantageous.
Daikondi,National,Business,Full Time,Male,2-3 years,HS,Position Title: Security Guard,High school graduate
Kabul,National,Health Care,Full Time,Any,6 years,BA,Position Title: Midwifery Program Officer,Excellent written and oral communication skills both in local languages and English. Ability and willingness to travel to USAID focus provinces as required.
Kabul,National,Business,Full Time,Male,4 years,BA,Position Title: AAM/Branch Manager (Re-Announced),
Kabul,National,Health Care,Full Time,Any,6 years,MD,Position Title: RMNH Officer,At least Six (6) years of relevant experience in a similar position preferably with international organizations or similar organizations.
Balkh,National,Banking/Accounting,Full Time,Male,1 year,BA,Position Title: Teller Haritan Branch   ,
Badghis,National,Health Care,Full Time,Any,3-5years,MD,Position Title: Hospital Manager,
Badghis,National,Health Care,Full Time,Any,3-years,MD,Position Title: Pediatric Specialist,
Kabul,National,Program/Project,Full Time,Female,7 years,BA,Position Title: Programme Development Manager/Proposal Writer,"Broad understanding of social, political and economic context of the country."
Herat,National,Program/Project,Full Time,Any,5years,BA,Position Title: Gender and Youth Specialist,"Bachelors degree in Agriculture/Livestock, Economics, Gender Studies, and Women Empowerment, with equivalent experience in women In Agriculture, Gender and youth Empowerment, Women Integration, and Gender and Youth mainstreaming."
Kabul,National,Business,Full Time,Any,5 years,BA,Position Title: Human Resource Manager,The candidate should have five (5) years of human resources senior management experience and work with system improvement.
Kabul,International,Other,Full Time,Any,5 years,MA,Position Title: WASH Cluster Co-Coordinator,"In addition to the monthly salary, the following package is also provided:"
Kabul,National,Other,Full Time,Any,2-3 years,BA,Position Title: Disability Specialist,
Kabul,National,Banking/Accounting,Full Time,Male,2-3 years,BA,Position Title: Deputy IT Audit Manager (Re Announced),
Kabul,National,Program/Project,Full Time,Any,5 years,BA,Position Title: Internal Auditor,Having understanding of the internal auditing standards.
Kandahar,National,Business,Full Time,Male,5 years,BA,Position Title: Admin & finance,"Excellent skills in financial management, accounting, budgeting and reporting"
Kunduz,National,Health Care,Full Time,Female,3 years,MD,Position Title: RH Supervisor,
Kunduz,National,Health Care,Full Time,Male,3 years,MD,Position Title: HRD Officer,
Sar-e Pol,National,Program/Project,Full Time,Any,5 years,BA,Position Title: FSL Project Manager,
Kunduz,National,Health Care,Full Time,Any,2 years,MD,Position Title: Cluster Supervisor,
Kabul,National,Security,Full Time,Any,5 years,BA,Position Title: National Senior Security Officer - PIU,
Jawzjan,National,Program/Project,Full Time,Male,2 years,BA,Position Title: District Coordinator,
Kabul,National,Engineering,Full Time,Any,7 years,BA,Position Title: National Senior Engineer - PIU,
Nangarhar,National,Program/Project,Full Time,Female,5years,BA,Position Title: District Communication Officer (DCO) - Only Female,
Kabul,National,Other,Full Time,Any,7 years,BA,Position Title: National Senior Social Development Specialist - PIU,
Bamian,National,Health Care,Full Time,Any,2-3 years,BA,Position Title: IT Assistant,
Kabul,National,Business,Full Time,Any,7 years,BA,Position Title: National Senior Finance Coordinator - PIU,
Nimruz,National,Program/Project,Full Time,Female,2 years,BA,Position Title: PSS Counselor (Psycho-Social Counselor),
Nangarhar,National,Program/Project,Full Time,Any,5years,BA,Position Title: District Communication Officer (DCO) - Nangarhar (Behsud District),
Badakhshan,National,Construction,Full Time,Any,5 years,BA,Position Title: Site Engineer,
Kabul,National,Program/Project,Full Time,Any,None,BA,Position Title: Assistant Programme Officer (HIV Prevention and Drug Demand Reduction),No experience is required with an advanced university degree.
Kabul,National,Program/Project,Full Time,Any,3-5 years,BA,Position Title: Community Mobilizer,Ability to fluently communicate in the local languages.
Logar,National,Engineering,Full Time,Male,5 years,BA,Position Title: Electrician,
Kabul,National,Security,Full Time,Any,5 years,BA,"Position Title: Health, Safety and Security Coordinator",Handling insecure environments
Logar,National,Other,Full Time,Male,5 years,HS,Position Title: Excavator Driver,More than 5 years of mechanical operation experience such as excavators.
Kabul,National,Education,Full Time,Any,3-5 years,BA,Position Title: Literacy and Numeracy Teacher,At least 3-5 years of experience working on education field and trainings and awareness session and workshops.
Kabul,National,Business,Full Time,Any,2 years,BA,Position Title: Supply Chain and Operations Assistant,
Kabul,National,Business,Full Time,Any,2-3 years,BA,Position Title: HR Assistant,
Ghazni,National,Security,Full Time,Male,None,HS,Position Title: Security Guard (Only Ghazni Residents),
Kunduz,National,Business,Full Time,Any,3 years,BA,Position Title: HR/Admin Officer,
Kabul,National,Communication,Full Time,Any,7 years,BA,Position Title: Reporting And Communication Manager,
