location,Nationality,job_Category,EmploymentType,gender,Experience_years,min Education,Name,KeySkills
Kunduz,National,Education,Full Time,Any,4 years,HS,Position Title: Community Mobilizer,"Strong oral and written communication skill in Pashto and Dari, skills in English will also be an asset."
Kunduz,National,Education,Full Time,Any,4 years,HS,Position Title: Community Mobilizer,"Strong oral and written communication skill in Pashto and Dari, skills in English will also be an asset."
Kunduz,National,Education,Full Time,Any,4 years,BA,Position Title: Master Trainer,Strong oral and written communication skill in Pashto; skills in Dari will also be an asset.
Kabul,National,Business,Full Time,Any,5 years,BA,Position Title: Finance and HR Officer,
Kabul,National,Education,Full Time,Male,3-5 years,BA,Position Title: The Quality Assurance Officer of the Educational Institution  ,
Kabul,National,Education,Full Time,Male,2 years,MA,Position Title: Lecturership BCS & BBA,
Kabul,National,Education,Full Time,Male,7-10 years,MA,Position Title: University Chancellor,
Kabul,National,Education,Full Time,Male,3-5 years,MA,Position Title: Student Affairs Specialist ,
Kabul,National,Other,Full Time,Male,7 years,BA,Position Title: Quantity Survey Engineer,Qualification
Zabul,National,Health Care,Full Time,Any,5 years,MD,Position Title: Technical Project Manager,
Bamian,National,Program/Project,Full Time,Female,2 years,BA,Position Title: Case Management Officer Only Female (Re Announced),
Kabul,National,Health Care,Full Time,Any,3 years,BA,Position Title: HR Assistant (Recruitment & Record Management) (Re Announced),"3 years of work experience in different HR capacities including some years of supervisory role, preferably with an international development organization."
Badghis,National,Program/Project,Full Time,Male,5 years,BA,Position Title: Provincial Manager,
Nangarhar,National,Construction,Full Time,Any,4 years,BA,Position Title: Engineers for Road Projects,
Kabul,National,Other,Full Time,Male,3-5 years,BA,Position Title: Guest House Manager and Events Coordinator,
Badghis,National,Engineering,Full Time,Male,5 years,BA,Position Title: WASH Engineer,
Badghis,National,Engineering,Full Time,Male,3 years,BA,Position Title: WASH Assistant,"Fully participate in carrying out surveys, including housetohouse visits and community meetings as requested."
Badghis,National,Health Care,Full Time,Any,3 years,BA,Position Title: Hygiene Trainer,
Badghis,National,Program/Project,Full Time,Any,3 years,HS,Position Title: Community Mobilizers,
Badghis,National,Facilities,Full Time,Male,4 years,BA,Position Title: Logistic Officer,Ensure all activities are carried out in line with ANURDO guidelines and procedures and according to any donor requirements.
Badghis,National,Other,Full Time,Male,3 years,BA,Position Title: Admin/Finance Officer,
Kabul,National,Program/Project,Full Time,Any,7 years,MA,Position Title: Institutional Development Manager,
Badghis,National,Program/Project,Full Time,Male,3 years,BA,Position Title: M&E Officer,
Balkh,National,Other,Full Time,Male,2 years,BA,Position Title: Admin/Logistic Officer,
Kabul,National,Information Technology,Full Time,Any,2 years,BA,Position Title: Application Developer,
Kabul,National,Business,Full Time,Any,5 years,BA,"Position Title: Director, Human Resources",Excellent verbal and written communication skills.
Kandahar,National,Program/Project,Full Time,Male,7 years,BA,Position Title: MEAL Officer,
Kabul,National,Other,Full Time,Any,7 years,BA,"Position Title: Specialist , HVC segment",
Kabul,National,Program/Project,Full Time,Any,4 years,BA,Position Title: Project Coordinator,
Faryab,National,Program/Project,Full Time,Male,3years,BA,Position Title: Scope Registrar,
Kabul,National,Other,Full Time,Any,7 years,BA,Position Title: National Senior Procurement Specialist,
Kabul,National,Other,Full Time,Any,7 years,BA,Position Title: National Senior Procurement Specialist  WERP Project,
Herat,National,Business,Full Time,Female,1 year,BA,Position Title: Finance Assistant (Daily),
Herat,National,Health Care,Full Time,Male,5 years,BA,Position Title: Regional Manager,
Nangarhar,National,Other,Full Time,Any,2 years,BA,Position Title: CBHC Officer,
Kabul,National,Health Care,Full Time,Any,2 years,BA,Position Title: Psychosocial Counselors,
Kabul,National,Business,Full Time,Any,6-10 years,MA,Position Title: Finance Accountant Manager,
Kabul,National,Health Care,Full Time,Male,2 years,BA,Position Title: Community Mobilizer,
Kabul,National,Program/Project,Full Time,Male,4 years,BA,Position Title: Master Trainer (Male),
Zabul,National,Health Care,Full Time,Any,3 years,BA,Position Title: PSS Counsellor Team Leader,
Kabul,Any,Business,Full Time,Any,3-5 years,BA,Position Title: Tax Consultant,
Kabul,National,Health Care,Full Time,Female,2 years,VD,Position Title: Life Skills Trainers,
Laghman,National,Program/Project,Full Time,Female,1 years,HS,Position Title: MHPSS Counselor,
Kapisa,National,Program/Project,Full Time,Male,3-5 years,BA,Position Title: Project Manager (Shelter Project),
Kabul,National,Program/Project,Full Time,Any,5-7 years,BA,Position Title: M&E Specialist,
Kandahar,Any,Health Care,Full Time,Male,3 years,MD,Position Title: Ultrasound Doctor / Sonologist,
Kabul,National,Communication,Full Time,Any,5 years,BA,Position Title: Communications and Reporting Manager,
Paktika,National,Health Care,Full Time,Male,1 year,HS,Position Title: Community Health Supervisor (Re Announced),"Good organization, planning and reporting skills."
Kandahar,National,Other,Full Time,Male,3-4 years,MD,Position Title: Data quality/Medical Record Officer.,
Kabul,National,Program/Project,Full Time,Any,5 years,BA,Position Title: Capacity Building Specialist,Excellent knowledge of the English language and computer (verbal and written)
Paktia,National,Health Care,Full Time,Female,1 year,BA,Position Title: Midwife  ,Diploma 
Kabul,National,Program/Project,Full Time,Any,5 years,BA,Position Title: English Teacher,
Balkh,National,Education,Full Time,Any,4 years,BA,Position Title: Teacher Trainer (Casual),"Extensive teaching experience in the subject areas. Very good training skills, good communication skills in national languages and fair level of written and spoken English."
Kabul,National,Program/Project,Full Time,Any,5 years,BA,Position Title: Institutional Development Analyst,Fluency in written and spoken English is required.
Kandahar,National,Health Care,Full Time,Male,3-4 years,MD,Position Title: Anesthesiologist (MD),
Faryab,National,Health Care,Full Time,Female,2 years,HS,Position Title: PSS Counsellor,Excellent communication skills
Faryab,National,Health Care,Full Time,Any,1 year,VD,Position Title: Nutrition Nurse,Graduated from nursing or midwifery program.
Kandahar,National,Health Care,Full Time,Male,3-4 years,BA,Position Title: Dental MD Doctor,
Herat,National,Program/Project,Full Time,Any,3 years,BA,Position Title: MEL Database Officer,
Parwan,National,Program/Project,Full Time,Female,3 years,BA,Position Title: Safe Space Officer,
Badghis,National,Health Care,Full Time,Male,3 years,MD,Position Title: EPI Officer,
Parwan,National,Program/Project,Full Time,Female,2 years,BA,Position Title: Community mobilizer,
Kabul,National,Pharmaceutical,Full Time,Male,1 year,BA,Position Title: Responsible in charge of Pharamcy licensing  ,
Kabul,National,Pharmaceutical,Full Time,Male,1 year,BA,Position Title: Licencing Expert of Provincial Pharmacy ,
Zabul,National,Health Care,Full Time,Female,3 years,MD,Position Title: Medical Doctor Team Leader,Previous experience in the management/coordination of community centers
Balkh,National,Program/Project,Full Time,Any,1-2 years,VD,Position Title: Surveyor/Distributer (Balkh),12 years of relevant experience
Kabul,National,Pharmaceutical,Full Time,Male,1 year,BA,Position Title: Responsible for the evaluation and registration team of manufactured spices,
Kabul,National,Pharmaceutical,Full Time,Male,1 year,BA,Position Title: Proform registration and health product output expert ,
Kabul,National,Business,Full Time,Any,7 years,BA,Position Title: Admin Finance Manager,
Nangarhar,National,Health Care,Full Time,Male,3 years,MD,Position Title: Pediatric Specialist,
Paktia,National,Education,Full Time,Male,4 years,BA,Position Title: Teacher Trainer (Casual),"Extensive teaching experience in the subject areas. Very good training skills, good communication skills in national languages and fair level of written and spoken English."
Herat,National,Business,Full Time,Any,2 years,BA,Position Title: Finance Officer,
Kabul,National,Program/Project,Full Time,Any,5 years,BA,Position Title: Sr. Database Manager and M&E Specialist,
Kabul,National,Business,Full Time,Any,7 years,BA,"Position Title: Community Mobilization Senior Associate , Multiple positions","A minimum of seven (7) years of experience in communication and liaison, community mobilization or other relevant fields is required."
Kabul,National,Health Care,Full Time,Any,2-3 years,BA,Position Title: Finance Officer,Proficiency in complex accounting systems and good level MS Excel skills.
Herat,National,Security,Full Time,Any,1-2 years,HS,Position Title: Watchman,
Kandahar,National,Health Care,Full Time,Female,3-4 years,MD,Position Title: GYN/OBs Surgeon,
Kabul,National,Education,Full Time,Male,7 years,MA,Position Title: Program Manager (Re Announced) (Re Announced),
Herat,National,Security,Full Time,Any,1-2 years,HS,Position Title: Watchman,
Khost,National,Security,Full Time,Any,1-2 years,HS,Position Title: Watchman,
Kabul,National,Education,Full Time,Male,5-8 years,MA,Position Title: Education Program Manager (Re Announced),
Maidan Wardak,National,Education,Full Time,Male,2 year,BA,Position Title: Admin/Finance Officer (Re Announced) (Re Announced),
Khost,National,Security,Full Time,Any,1-2 years,HS,Position Title: Watchman,
Takhar,National,Education,Full Time,Male,2 year,BA,Position Title: Admin/Finance Officer (Re Announced),
Kandahar,National,Health Care,Full Time,Male,5-6 years,MD,Position Title: Head of Surgical Department.,
Khost,National,Security,Full Time,Any,1-2 years,HS,Position Title: Watchman,
Logar,National,Program/Project,Full Time,Any,3 years,MA,Position Title: PMEAL Officer,
Kandahar,National,Health Care,Full Time,Male,3-4 years,BA,Position Title: Nursing Director.,
Kandahar,National,Health Care,Full Time,Male,2-3 years,VD,Position Title: Pharmacy Technician.,
Parwan,National,Program/Project,Full Time,Female,2 years,BA,Position Title: Community Mobilizer (Re Announced),Ability to travel remote areas and district.
Kabul,National,Business,Full Time,Male,5 years,BA,Position Title: Finance Manager (Re Announced),
Kabul,National,Education,Full Time,Male,5 years,BA,Position Title: Project Officer (Re Announced),
Badghis,National,Health Care,Full Time,Male,5 years,MD,Position Title: Provincial Officer,
Kabul,International,Engineering,Full Time,Any,7 years,MA,Position Title: Senior Project Manager,"At least 7 years (or more based on academic credentials) of progressive experience in managing infrastructure projects, water supply projects, or renewable energy projects, with focus on monitoring, reporting, development and coordination in either public or private sector organizations."
Balkh,National,Program/Project,Full Time,Any,5 years,BA,Position Title: National Engineer,
Kabul,National,Business,Full Time,Any,6 years,SS,"Position Title: Finance Associate, Multiple positions","Minimum of 6 years of relevant working experience within the areas of finance, accounting, business administration or related field is required."
Herat,National,Health Care,Full Time,Male,3 years,MD,Position Title: Senior Technical Officer (Re Announced),
Kabul,National,Business,Full Time,Any,7 years,BA,Position Title: MARKETING MANAGER,
Khost,National,Business,Full Time,Any,3-5 years,BA,Position Title: Project Manager (Child Protection),
Khost,National,Business,Full Time,Any,3-5 years,BA,Position Title: Psycho Social Support (PSS) Counsellor,
Khost,National,Other,Full Time,Any,3-5 years,BA,Position Title: Case Management Officer,
Kabul,Any,Education,Part Time,Any,1-3 years,BA,"Position Title: School Teachers, Cambridge Subjects (Computer, Chemistry, Mathematics, Biology, Physics, English) Headmistress & Cambridge Computer Teacher(Balkh)",
Samangan,National,Business,Full Time,Any,5 years,MA,Position Title: Operations Manager (Re Announced) (Re Announced),
Balkh,National,Other,Full Time,Any,2 years,BA,Position Title: Quantitative Survey Enumerator,
Balkh,National,Other,Full Time,Any,2 years,BA,Position Title: Qualitative Survey Enumerator,
Kabul,National,Information Technology,Full Time,Any,2 year,BA,Position Title: ICT Officer (Re Announced),
Kabul,National,Other,Full Time,Any,1 year,HS,Position Title: Data Clerk (Quantitative and Qualitative),
Khost,National,Health Care,Full Time,Any,3 years,MD,Position Title: Medical Doctor,Detailoriented and selfmotivated.
Kabul,National,Information Technology,Full Time,Any,5 years,MA,Position Title: Information Manager,Staff management experience
Kabul,National,Health Care,Full Time,Any,2 years,MD,Position Title: Medical Doctor PD13,
Nangarhar,National,Program/Project,Full Time,Female,2 years,SS,Position Title: IYCF Counsellor (Female Only),
Nangarhar,National,Program/Project,Full Time,Female,2 years,SS,Position Title: IYCF Counsellor (Female Only),