,Location,Nationality,Job_Category,Employment_Type,Gender,Years_Of_Experience,Minimum_Education,Job_Title
1043,Kabul City,National,Business,Full Time,Male,1.0,BA,Position Title: Islmaic Radio Producer
1044,Kabul City,National,Business,Full Time,Male,1.0,BA,Position Title: Sport Producer 
1045,Kabul City,National,Business,Full Time,Male,1.0,BA,Position Title:  YouTube Producer
1046,Kabul City,National,Business,Full Time,Male,2.0,BA,Position Title: Graphic Designer  
1047,Kabul City,National,Business,Full Time,Male,2.0,BA,Position Title: Video Editor  
1048,Kabul City,National,Business,Full Time,Male,1.0,BA,Position Title: Professional Member of Dari Website 
1049,Kabul City,National,Business,Full Time,Male,6.0,BA,Position Title: AAM/Branch Manager (Re Announced)
1050,Kabul Zone,National,Health,Full Time,Any,4.0,BA,Position Title: Project Manager
1051,Kabul Zone,National,Health,Full Time,Any,0.0,BA,Position Title: Project Officer
1052,Kabul Zone,National,Health,Full Time,Any,0.0,BA,Position Title: M&E Officer
1053,Kabul City,National,Business,Full Time,Male,4.0,BA,Position Title: Admin/ HR Manager
1054,East Zone,National,Business,Full Time,Male,7.0,MA,Position Title: Site Coordinator
1055,East Zone,National,Others,Full Time,Any,2.5,BA,Position Title: Returnee Monitoring Officer
1056,Kabul City,National,Health,Full Time,Female,3.0,BA,Position Title: OBGYN Specialist
1057,West Zone,National,Health,Full Time,Female,1.0,BA,Position Title: Midwife
1058,East Zone,National,Others,Full Time,Any,2.5,MA,Position Title: Crowd Controller
1059,Kabul City,National,Health,Full Time,Any,3.0,BA,Position Title: Dermatologist
1060,East Zone,National,Others,Full Time,Any,2.5,BA,Position Title: Verification officer
1061,East Zone,National,Others,Full Time,Any,2.5,BA,Position Title: Vaccinator
1062,West Zone,National,Health,Full Time,Male,2.5,BA,Position Title: Provincial Officer
1063,Kabul City,Any,Business,Full Time,Any,7.0,MA,Position Title: Head of Engagement (Advocacy and Communications)
1064,Kabul City,National,Health,Full Time,Any,7.0,MA,"Position Title: Technical Advisor, Pharmaceutical Regulatory Affairs"
1065,Kabul City,National,Education,Part Time,Any,2.0,BA,"Position Title: Teacher (English, Mathematic, and Computer Instructor )"
1066,East Zone,National,Business,Full Time,Any,2.0,BA,Position Title: Education Assistant
1067,Kabul City,National,Business,Full Time,Any,4.0,BA,Position Title: Admin & Logistic Officer
1068,Kabul City,National,Business,Full Time,Any,1.5,BA,Position Title: Assistant Procurement Officer
1069,Kabul City,Any,Business,Part Time,Any,2.0,BA,Position Title: Marketing Manager
1070,North-East Zone,National,Business,Full Time,Any,2.0,BA,Position Title: District Manager (Re-Announced)
1071,West Zone,National,Education,Full Time,Male,2.0,BA,Position Title: Konkur and Remedial Trainer
1072,East Zone,National,Health,Full Time,Male,2.0,BA,Position Title: MHT Medical Doctor
1073,Central Highlands,National,Business,Full Time,Any,5.0,BA,Position Title: Deputy Field Coordinator (Re Announced)
1074,Kabul City,National,Business,Full Time,Any,3.5,,Position Title: Procurement Officer
1075,Kabul Zone,National,Business,Full Time,Female,2.5,MD,Position Title: FHH Midwife
1076,Kabul City,National,Business,Full Time,Any,3.0,BA,Position Title: Procurement Assistant
1077,East Zone,National,Business,Full Time,Any,4.0,BA,Position Title: Regional M&E Officer
1078,West Zone,National,Business,Full Time,Male,5.0,BA,Position Title: M&E Officer (Re Announced) (Re Announced)
1079,East Zone,National,Business,Full Time,Female,2.0,BA,Position Title: Child Protection Case Management Officer (Female Only)
1080,Kabul City,National,Others,Full Time,Any,3.0,BA,Position Title: Safeguarding Officer
1081,Central Highlands,National,Health,Full Time,Any,2.0,BA,Position Title: Data Clerk
1082,Kabul City,National,Business,Full Time,Any,0.0,,Position Title: Supply Chain Manager
1083,West Zone,National,Business,Full Time,Female,2.5,MD,Position Title: Backup Midwife
1084,Kabul City,National,Business,Full Time,Any,5.0,BA,"Position Title: Marketing, Communication & Information Officer"
1085,Kabul City,National,Health,Full Time,Any,3.0,BA,Position Title: Medical Warehouse Assistant (Re-Announced)
1086,Kabul City,National,Business,Full Time,Male,4.0,BA,Position Title: Finance Manager
1087,East Zone,National,Business,Full Time,Male,3.0,HS,Position Title: Pharma Warehouse Porter (Male Only)
1088,East Zone,National,Business,Full Time,Male,2.0,BA,Position Title: Pharma Storekeeper Assistant (Male Only)
1089,Kabul City,National,Business,Full Time,Any,3.0,BA,Position Title: HR Recruitment & Development Officer
1090,Kabul City,National,Business,Full Time,Any,7.0,BA,Position Title: Senior Finance Manager ( Budgeting and Financial Planning) (Re Announced)
1091,Kabul City,National,Business,Full Time,Any,6.0,BA,Position Title: Finance and Admin Manager
1092,Kabul City,National,Business,Full Time,Male,1.0,BA,Position Title: Teller Karte Naw Branch 
1093,Kabul City,National,Engineering,Full Time,Any,5.0,BA,Position Title: Project Manager (Construction)
1094,Kabul City,National,Business,Full Time,Any,6.0,BA,Position Title: Internal Auditor
1095,Kabul City,National,Others,Full Time,Male,1.0,,Position Title: Deputy Field Coordinator (Re Announced)
1096,East Zone,National,Business,Full Time,Any,3.0,BA,Position Title: Admin Associate
1097,Kabul City,National,Business,Full Time,Any,7.0,HS,Position Title: National Programme Associate (Survey and Research)
1098,North-Zone,National,Business,Full Time,Female,1.0,HS,Position Title: Community Outreach Officer
1099,Kabul City,National,Business,Full Time,Any,4.0,BA,Position Title: National Programme Officer (Survey and Research)
1100,North-East Zone,National,Business,Full Time,Male,1.0,BA,Position Title: HR assistant (Learning and Development)
1101,North-Zone,National,Business,Full Time,Any,5.0,BA,Position Title: PSS Counselor Coordinator
1102,North-Zone,National,Health,Full Time,Any,5.0,MD,Position Title: TB Provincial Focal Point
1103,Kabul City,National,Business,Full Time,Any,10.0,BA,Position Title: Community Engagement Deputy Coordinator
1104,South Zone,National,Health,Full Time,Any,3.5,MD,Position Title: Regional EOC Manager
1105,Kabul City,National,Business,Full Time,Any,5.0,BA,Position Title: Treasury Manager
1106,Kabul Zone,National,Health,Full Time,Female,1.0,BA,Position Title: Clinick Doctor   
1107,Kabul City,National,Business,Full Time,Male,2.0,BA,Position Title: General Management of Accident  Evaluation
1108,East Zone,National,Business,Full Time,Any,4.0,BA,Position Title: Provincial Manager
1109,East Zone,National,Business,Full Time,Any,2.5,BA,Position Title: Nutrition Officer
1110,East Zone,National,Business,Full Time,Male,3.0,BA,Position Title: Admin & Finance Officer
1111,East Zone,National,Business,Full Time,Female,3.0,BA,Position Title: Monitoring & Evaluation Officer
1112,Central Highlands,National,Health,Full Time,Any,3.0,BA,Position Title: Psychosocial Counsellor
1113,East Zone,National,Business,Full Time,Female,3.0,BA,Position Title: Master Trainer
1114,East Zone,National,Others,Full Time,Female,2.5,BA,Position Title: Vocational Trainers
1115,East Zone,National,Legal,Full Time,Female,3.0,BA,Position Title: Legal Adisor
1116,East Zone,National,Business,Full Time,Female,3.0,BA,Position Title: Surveyor
1117,Central Highlands,National,Health,Full Time,Female,2.0,MD,Position Title: Female Doctors
1118,East Zone,National,IT,Full Time,Female,2.0,BA,Position Title: Database Assistant
1119,Kabul City,National,Engineering,Full Time,Any,5.0,BA,Position Title: Office Engineer
1120,East Zone,National,Others,Full Time,Male,3.0,BA,Position Title: Storekeeper
1121,South Zone,National,Health,Full Time,Any,5.0,BA,"Position Title: Immunization Specialist (Polio and EPI), NOC, Fixed Term, Kandahar Field Office, Afghanistan #86506, (Open to Afghan Nationals) only)"
1122,Kabul City,National,IT,Full Time,Any,7.0,BA,Position Title: Manager Cybersecurity
1123,Kabul City,National,Business,Full Time,Any,5.0,BA,Position Title: National Health Officer
1124,Kabul City,National,Legal,Full Time,Any,5.0,BA,Position Title: Specialist in Legal Affairs
1125,Kabul City,National,IT,Full Time,Any,5.0,BA,Position Title: ICT Senior Specialist
1126,Kabul City,National,Business,Full Time,Any,5.0,BA,Position Title: Economic Specialist 
1127,Kabul City,National,Business,Full Time,Any,0.0,BA,Position Title: Interns (Program Team)
1128,Kabul City,National,Business,Full Time,Any,0.0,BA,Position Title: Interns (Support Team)
1129,North-East Zone,National,Security,Full Time,Male,5.0,BA,Position Title: Regional Security & Access Officer (RO - Security)
1130,Kabul City,National,Business,Full Time,Female,4.0,BA,Position Title: Editor in Chief
1131,North-Zone,National,Health,Full Time,Female,5.0,MD,Position Title: RH Officer
1132,North-Zone,National,Health,Full Time,Any,3.0,MD,Position Title: HQIP Officer
1133,North-Zone,National,Health,Full Time,Any,3.0,BA,Position Title: Pharmacy Officer
1134,North-Zone,National,Health,Full Time,Female,5.0,BA,Position Title: Female MD
1135,Kabul City,National,Engineering,Full Time,Male,3.0,BA,Position Title: WASH Officer
1136,Kabul City,National,IT,Full Time,Any,2.0,BA,Position Title: ICT Officer
1137,South Zone,National,Agriculture,Full Time,Any,3.5,BA,Position Title: Agriculturist
1138,Kabul City,National,Business,Full Time,Any,3.0,BA,Position Title: Procurement Officer
1139,South Zone,National,Business,Full Time,Any,5.5,BA,Position Title: Livestock Coordinator
1140,Kabul City,National,Business,Full Time,Any,3.0,BA,Position Title: Logistic Officer
1141,Kabul City,National,Business,Full Time,Any,4.0,BA,Position Title: IT Officer
1142,West Zone,National,Business,Full Time,Any,2.5,BA,Position Title: Protection officer - Caseworker Afghanistan Herat (Only Afghan National)
1143,South Zone,National,Others,Full Time,Any,5.0,BA,Position Title: Operation Manager (Re Announced)
1144,North-Zone,National,Others,Full Time,Any,1.0,HS,Position Title: Surveyor/Enumerator
1145,Kabul City,National,Business,Full Time,Any,4.0,BA,Position Title: Strategic Communications Specialist
1146,Kabul City,National,IT,Full Time,Any,7.0,MA,Position Title: Logistics Management Information Systems (LMIS) Senior Officer
1147,West Zone,National,Business,Full Time,Male,3.0,BA,Position Title: Child friendly space supervisor
1148,South Zone,National,Business,Full Time,Any,3.0,BA,Position Title: Project Officer
1149,South Zone,National,Health,Full Time,Any,7.0,MA,Position Title: Senior Provincial Manager (Re Announced)
1150,Kabul City,National,Business,Full Time,Any,3.0,BA,Position Title: Fleet Assistant
1151,South Zone,National,Business,Full Time,Any,3.0,BA,Position Title: Community Mobilizer
1152,South Zone,National,Agriculture,Full Time,Male,5.0,BA,Position Title: Project Coordinato
1153,South Zone,National,Agriculture,Full Time,Any,5.0,BA,Position Title: Agriculture Trainer
1154,Kabul City,National,Others,Full Time,Female,3.0,BA,Position Title: Safe and Inclusive Programming Coordinator
1155,South Zone,National,Others,Full Time,Any,5.0,BA,Position Title: Complaints and Response Mechanism (CRM) Officer
1156,Kabul City,National,Education,Full Time,Female,4.0,BA,Position Title: Child Protection Officer
1157,Kabul City,National,Others,Full Time,Male,2.0,HS,Position Title: Vaccinator
1158,Kabul City,Any,Business,Full Time,Any,7.0,MA,Position Title: SENIOR CHILD PROTECTION ADVISOR
1159,East Zone,National,Business,Full Time,Any,2.5,BA,Position Title: Protection Monitor
1160,East Zone,National,Business,Full Time,Any,2.5,BA,Position Title: GDT Distributor/Call Operator
1161,Kabul City,National,Business,Full Time,Any,4.0,BA,Position Title: Project Manager (Livelihoods and Food Security)
1162,East Zone,National,Health,Full Time,Female,2.0,BA,Position Title: Physiotherapist
1163,North-Zone,National,Business,Full Time,Any,4.0,HS,Position Title: Community Mobilizer Couples
1164,East Zone,National,Health,Full Time,Female,2.0,BA,Position Title: Physiotherapist
1165,Kabul Zone,National,Health,Full Time,Female,2.0,BA,Position Title: Physiotherapist
1166,Central Highlands,National,IT,Full Time,Male,2.0,BA,Position Title: Surveyor/SCOPE Distribution Officer
1167,Kabul Zone,National,Health,Full Time,Female,2.0,BA,Position Title: Physiotherapy Teacher
1168,East Zone,National,Health,Full Time,Female,2.0,BA,Position Title: Physiotherapy Teacher
1169,Central Highlands,National,Others,Full Time,Male,2.0,BA,Position Title: Distributor
1170,Central Highlands,National,Others,Full Time,Any,2.0,BA,Position Title: Information Desk Officer
1171,Central Highlands,National,Security,Full Time,Any,2.0,BA,Position Title: Crowd Control
1172,Kabul City,National,Business,Full Time,Female,3.0,BA,Position Title: Field Supervisor
1173,North-Zone,National,Health,Full Time,Female,4.0,BA,Position Title: MD / GYNE & Ultrasound Specialist
1174,Kabul Zone,National,Business,Full Time,Any,3.0,BA,Position Title: Administrative Assistant Kapisa
1175,Kabul City,National,Business,Full Time,Any,3.0,HS,"Position Title: Sanitation/Hygiene promoters, and Community Mobilizers-Couples (Kabul and Nearby Provinces)"
1176,East Zone,National,Others,Full Time,Male,4.0,BA,Position Title: Project Officer
1177,Kabul City,National,Others,Full Time,Any,2.5,BA,Position Title: Surveyor/Distributor
1178,Kabul City,Any,Business,Full Time,Any,8.0,BA,Position Title: Head Of New Business Development (Re Announced)
1179,Kabul City,National,Business,Full Time,Any,3.0,BA,Position Title: WASH Officer: (WASH in Emergency & AWD/Cholera Expert).
1180,Kabul City,Any,Business,Full Time,Any,10.0,MA,Position Title: Head of Technical Unit (Re Announced)
1181,Kabul City,National,Others,Full Time,Any,1.0,BA,Position Title: Assistant Information Management Officer
1182,Kabul City,National,Business,Full Time,Any,5.0,BA,Position Title: CARPETS VALUE CHAIN EXPERT
1183,Kabul City,National,Business,Full Time,Any,5.0,BA,Position Title: CASHMERE VALUE CHAIN EXPERT
1184,Kabul City,National,Business,Full Time,Any,5.0,BA,Position Title: NATURAL STONE VALUE CHAIN EXPERT
1185,Kabul City,National,Business,Full Time,Any,5.0,BA,Position Title: SAFFRON VALUE CHAIN EXPERT
1186,South Zone,National,Others,Full Time,Male,2.0,HS,Position Title: Store Keeper
1187,South Zone,National,Others,Full Time,Male,2.0,,Position Title: Guard & Cleaner
1188,East Zone,National,Business,Full Time,Male,3.0,BA,Position Title: Information Desk officer
1189,Kabul City,National,Business,Full Time,Any,3.0,BA,Position Title: Reporting officer
1190,North-Zone,National,Others,Full Time,Any,5.0,BA,Position Title: Tailor 
1191,East Zone,National,Business,Full Time,Any,5.5,BA,Position Title: Awareness Raising Facilitator
1192,East Zone,National,Business,Full Time,Any,4.0,BA,Position Title: Gender Officer
1193,East Zone,National,Business,Full Time,Any,5.5,BA,Position Title: Master Trainer
1194,East Zone,National,Business,Full Time,Any,0.0,BA,Position Title: Legal Officer
1195,East Zone,National,Business,Full Time,Any,5.5,BA,Position Title: Information Media Officer
1196,Kabul City,National,Health,Full Time,Any,3.5,BA,Position Title:   (Medical Doctor)
1197,Kabul City,National,Health,Full Time,Any,3.5,BA,Position Title: Vaccinator
1198,East Zone,National,Business,Full Time,Any,3.0,BA,Position Title: Monitoring and Evaluation Officer
1199,Kabul City,National,Health,Full Time,Any,3.5,BA,Position Title: EPI Supervisor
1200,Kabul City,National,Health,Full Time,Any,3.0,BA,Position Title: Nutrition Supervisor
1201,East Zone,National,Business,Full Time,Any,3.5,VD,Position Title: Social Worker
1202,Kabul City,National,Health,Full Time,Any,3.0,BA,Position Title: Nutritional Consultant 
1203,East Zone,National,Business,Full Time,Any,5.5,BA,Position Title: Psychosocial Counselor
1204,East Zone,National,Business,Full Time,Any,8.0,BA,Position Title: Project Manager
1205,East Zone,National,Business,Full Time,Any,4.5,BA,Position Title: Data Entry Clerk
1206,East Zone,National,Business,Full Time,Any,5.5,BA,Position Title: Business Development Officer
1207,East Zone,National,Business,Full Time,Any,5.5,BA,Position Title: Case Management Officer
1208,East Zone,National,Others,Full Time,Any,5.0,HS,Position Title: Security Guard
1209,Kabul City,National,Health,Full Time,Male,3.0,MD,Position Title: BMGF PHC project focal point
1210,East Zone,National,Business,Full Time,Any,6.0,BA,Position Title: Finance Officer
1211,East Zone,National,Business,Full Time,Any,3.5,BA,Position Title: Administration Officer
1212,Kabul City,Any,Engineering,Full Time,Any,7.0,HS,Position Title: Video Animator (2D & 3D)
1213,Kabul City,National,Business,Full Time,Any,3.0,BA,Position Title: Senior Credit Officer / Regional Supervisor- Kabul
1214,Kabul City,National,Business,Full Time,Any,4.0,BA,Position Title: Access & Liaison Officer
1215,North-Zone,National,Business,Full Time,Any,2.0,BA,Position Title: Camp Management Assistant - Receptionist
1216,North-Zone,National,Others,Full Time,Any,3.0,BA,Position Title: Camp Management Officer (Cash Grant)
1217,North-Zone,National,Business,Full Time,Male,3.0,BA,Position Title: Coordination Manager
1218,East Zone,National,Legal,Full Time,Any,2.5,BA,Position Title: Protection Officer - (Psychosocial Support Services)
1219,Kabul City,National,Others,Full Time,Female,3.0,BA,Position Title: Grants Officer (Only Female) (Re Announced)
1220,South Zone,National,Others,Full Time,Any,3.0,BA,Position Title: Grant Officer (Re Announced)
1221,South Zone,National,Others,Full Time,Any,2.5,BA,Position Title: Social Mobilizers (Locally Recruitment) (Re Announced)
1222,Kabul City,National,IT,Full Time,Any,5.0,BA,Position Title: Senior Software Engineer - Full Stack Developer
1223,Kabul City,National,IT,Full Time,Any,4.0,BA,Position Title: Senior ICT Officer
1224,Kabul City,National,Business,Full Time,Any,4.0,BA,Position Title: Senior Finance Officer
1225,Kabul City,National,Health,Full Time,Male,2.5,SS,Position Title: Ambulance Driver
1226,Kabul City,National,Business,Full Time,Male,3.0,BA,Position Title: Finance Assistant
1227,East Zone,National,Business,Full Time,Female,2.5,BA,Position Title: Protection Monitor
1228,East Zone,National,Business,Full Time,Male,2.5,BA,Position Title: Enumerator
1229,East Zone,National,Health,Full Time,Female,4.0,BA,Position Title: MD / GYNE & Ultrasound Specialist
1230,Kabul City,National,Business,Full Time,Any,5.0,BA,Position Title: Credit and Finance Specialist
1231,Kabul City,National,Business,Full Time,Any,1.0,,Position Title: Project Manager
1232,Kabul City,National,Others,Full Time,Male,2.5,BA,Position Title: Media Assistant
1233,East Zone,National,Business,Full Time,Male,7.0,MA,Position Title: Project Coordinator
1234,North-Zone,National,Others,Full Time,Any,5.0,BA,Position Title: Protection Team Leader
1235,North-Zone,National,Others,Full Time,Any,5.0,BA,Position Title: Protection Officer
1236,North-Zone,National,Others,Full Time,Any,3.0,BA,Position Title: Protection Assistant
1237,North-East Zone,National,Business,Full Time,Any,3.0,BA,"Position Title: Sr. MEAL (Monitoring, Evaluation, Accountability & Learning) Officer"
1238,North-Zone,National,Others,Full Time,Male,2.0,HS,Position Title: Community Health Supervisor - CHS
1239,Kabul City,National,Business,Full Time,Female,4.0,BA,Position Title: MEAL Manager- Accountability and Learning (Female Only)
1240,North-East Zone,National,Business,Full Time,Any,2.0,BA,Position Title: Supply Chain Assistant
1241,Central Highlands,National,Business,Full Time,Male,1.0,BA,Position Title: teller
1242,West Zone,National,Others,Full Time,Any,2.0,BA,Position Title: Supply Chain Assistant
1243,Kabul City,National,Health,Part Time,Female,5.0,BA,Position Title: Quality Consultant - MSI Afghanistan (Re Announced)
1244,Kabul City,National,Business,Full Time,Any,4.0,BA,Position Title: Program Manager Health- Re announced
1245,South Zone,National,Health,Full Time,Female,5.0,MD,Position Title: Gynecological surgeon    
1246,North-Zone,National,Health,Full Time,Male,2.0,VD,Position Title: Pharmacist 
1247,Kabul City,National,Health,Full Time,Any,10.0,MD,Position Title: National Project Manager- Health Emergency Response (HER)
1248,West Zone,National,Business,Full Time,Any,2.0,BA,Position Title: Entrepreneurship Development Assistant
1249,East Zone,National,Business,Full Time,Female,1.5,HS,Position Title: Vocational Skill Trainers
1250,Kabul City,National,IT,Full Time,Any,4.0,BA,Position Title: MIS Developer
1251,Central Highlands,National,Health,Full Time,Female,3.0,BA,Position Title: Clinick Doctor 
1252,Central Highlands,National,Health,Full Time,Female,3.0,BA,Position Title: Clinick Doctor 
1253,Central Highlands,National,Health,Full Time,Female,3.0,BA,Position Title: Clinick Doctor 
1254,Kabul City,National,Business,Full Time,Any,5.0,HS,Position Title: Cook
1255,Kabul City,National,Education,Full Time,Female,2.0,BA,Position Title: Pashto Language and Islamic Studies Teacher
1256,West Zone,National,Health,Full Time,Female,3.0,BA,Position Title: General Internal Medicine Specialist
1257,Kabul City,National,Others,Full Time,Male,2.0,BA,Position Title:Sampling Professional Member (Re Announced)
1258,West Zone,National,Health,Full Time,Female,3.0,BA,Position Title: (IMCI) Nurse
1259,Kabul City,National,Others,Full Time,Any,3.0,BA,Position Title: Sampling Team Leader (Re Announced)
1260,Kabul City,National,Education,Part Time,Female,2.0,BA,Position Title: Math Teacher
1261,East Zone,National,Health,Full Time,Any,2.0,BA,Position Title: Pharmacy Stock Keeper
1262,South Zone,National,Business,Full Time,Male,1.0,BA,Position Title: teller
1263,West Zone,National,Health,Full Time,Female,3.0,BA,Position Title: Pharmacist
1264,Kabul City,National,Business,Full Time,Male,2.0,BA,Position Title: Merchandising Assistant
1265,Kabul City,National,Others,Full Time,Male,2.0,BA,Position Title: Professional Member of value-added services (Re Announced)
1266,Kabul City,National,Others,Full Time,Any,2.0,BA,Position Title: Professional Member of Monitoring Team (Re Announced)
1267,West Zone,National,Health,Full Time,Female,2.0,BA,Position Title: Medical Recorder
1268,West Zone,National,Health,Full Time,Female,2.0,BA,Position Title: Stock Keeper
1269,South Zone,National,Health,Full Time,Male,3.0,BA,Position Title: Physiotherapist (PT)
1270,West Zone,National,Engineering,Full Time,Male,2.0,BA,Position Title: Electrician
1271,West Zone,National,Business,Full Time,Any,3.0,HS,Position Title: Education Technical Extender
1272,Kabul City,National,Security,Full Time,Male,4.0,HS,Position Title: Security Officer
1273,Kabul City,Any,Health,Full Time,Male,2.0,MA,Position Title: General Physician Specialist
1274,Kabul City,National,Business,Full Time,Male,5.0,MA,Position Title: M&E Coordinator
1275,East Zone,National,Business,Full Time,Any,3.0,BA,Position Title: MEAL Officer NGR
1276,North-Zone,National,Education,Full Time,Any,3.0,BA,Position Title: English Trainer
1277,Kabul City,National,Others,Full Time,Male,3.5,BA,Position Title: Procurement and Documentation Officer
1278,Kabul City,National,IT,Full Time,Any,0.0,BA,Position Title: Web and Social Media Administrator
1279,Kabul City,National,Engineering,Full Time,Male,7.0,BA,Position Title: Proposal Writer ( Civil Engineer )
1280,Kabul City,National,Business,Full Time,Any,3.0,BA,Position Title: Digital Marketer
1281,North-Zone,National,Business,Full Time,Any,3.0,BA,Position Title: Agribusiness Marketing Officer
1282,Kabul City,National,Others,Full Time,Any,7.0,BA,Position Title: Event Manager
1283,North-Zone,National,Education,Full Time,Any,6.0,MA,Position Title: Senior Community-based Social Behavior Change (SBC) & Communication Officer
1284,Kabul City,National,Others,Full Time,Male,4.5,MD,Position Title: Marketing Manager
1285,Kabul City,National,Business,Full Time,Any,3.5,BA,Position Title: Finance Audit Officer
1286,Kabul City,National,Business,Full Time,Male,2.0,HS,Position Title: electrician
1287,Kabul City,Any,Business,Full Time,Any,2.0,MA,Position Title: Country Director
1288,East Zone,National,Others,Full Time,Female,2.0,BA,Position Title: Eterprise Officer
1289,East Zone,National,Others,Full Time,Female,2.0,BA,Position Title: PSS Officer
1290,East Zone,National,Others,Full Time,Female,3.0,BA,Position Title: Legal Officer
1291,North-Zone,Any,Education,Full Time,Any,3.0,BA,Position Title: English Trainer
1292,Kabul City,National,Business,Full Time,Any,4.5,BA,Position Title: Human Resources and Finance Manager
1293,Kabul City,National,IT,Full Time,Any,4.5,BA,Position Title: IT Officer
1294,Kabul City,National,Business,Full Time,Any,4.5,BA,Position Title: Procurement Officer
1295,North-East Zone,National,Business,Full Time,Any,1.0,BA,Position Title: Surveyor/ Data Enumerator
1296,Kabul City,National,Health,Full Time,Any,3.0,MD,Position Title: Stomatolog MD
1297,Kabul City,National,Business,Full Time,Male,2.0,BA,Position Title: Admin Finance Assistant
1298,Kabul City,National,Business,Full Time,Male,2.0,BA,Position Title: Finance officer
1299,Kabul City,National,Others,Part Time,Any,1.5,HS,Position Title: Graphic Designer
1300,Kabul City,National,Business,Part Time,Male,5.0,MA,Position Title: Sharia Advisory Board Member
1301,Kabul City,National,Others,Full Time,Male,7.0,BA,Position Title: Accountant
1302,Kabul City,National,Engineering,Full Time,Any,3.0,HS,Position Title: Graphic Designer
1303,Kabul City,National,Education,Full Time,Any,5.0,MA,Position Title: Math Expert (Re Announced)
1304,West Zone,National,Others,Full Time,Male,2.0,MD,Position Title: Cluster Supervisor
1305,Kabul City,Any,Business,Full Time,Male,5.0,MA,Position Title: Director
1306,Kabul Zone,National,Health,Full Time,Any,4.0,BA,Position Title: Project Manager
1307,Kabul Zone,National,Health,Full Time,Any,2.0,BA,Position Title: Project Officer
1308,Kabul Zone,National,Health,Full Time,Any,2.0,BA,Position Title: M&E Officer
1309,Kabul City,National,Business,Full Time,Male,4.0,BA,Position Title: Admin/ HR Manager
