,Location,Nationality,Job_Category,Employment_Type,Gender,Years_Of_Experience,Minimum_Education,Job_Title
1824,Kabul City,National,Business,Full Time,Any,5.0,BA,Position Title: Institutional Development Analyst
1825,South Zone,National,Health,Full Time,Male,3.5,MD,Position Title: Anesthesiologist (MD)
1826,North-Zone,National,Health,Full Time,Female,2.0,HS,Position Title: PSS Counsellor
1827,North-Zone,National,Health,Full Time,Any,1.0,VD,Position Title: Nutrition Nurse
1828,South Zone,National,Health,Full Time,Male,3.5,BA,Position Title: Dental MD Doctor
1829,West Zone,National,Business,Full Time,Any,3.0,BA,Position Title: MEL Database Officer
1830,Kabul Zone,National,Business,Full Time,Female,3.0,BA,Position Title: Safe Space Officer
1831,West Zone,National,Health,Full Time,Male,3.0,MD,Position Title: EPI Officer
1832,Kabul Zone,National,Business,Full Time,Female,2.0,BA,Position Title: Community mobilizer
1833,Kabul City,National,Health,Full Time,Male,1.0,BA,Position Title: Responsible in charge of Pharamcy licensing  
1834,Kabul City,National,Health,Full Time,Male,1.0,BA,Position Title: Licencing Expert of Provincial Pharmacy 
1835,South Zone,National,Health,Full Time,Female,3.0,MD,Position Title: Medical Doctor Team Leader
1836,North-Zone,National,Business,Full Time,Any,1.5,VD,Position Title: Surveyor/Distributer (Balkh)
1837,Kabul City,National,Health,Full Time,Male,1.0,BA,Position Title: Responsible for the evaluation and registration team of manufactured spices
1838,Kabul City,National,Health,Full Time,Male,1.0,BA,Position Title: Proform registration and health product output expert 
1839,Kabul City,National,Business,Full Time,Any,7.0,BA,Position Title: Admin Finance Manager
1840,East Zone,National,Health,Full Time,Male,3.0,MD,Position Title: Pediatric Specialist
1841,East Zone,National,Education,Full Time,Male,4.0,BA,Position Title: Teacher Trainer (Casual)
1842,West Zone,National,Business,Full Time,Any,2.0,BA,Position Title: Finance Officer
1843,Kabul City,National,Business,Full Time,Any,5.0,BA,Position Title: Sr. Database Manager and M&E Specialist
1844,Kabul City,National,Business,Full Time,Any,7.0,BA,"Position Title: Community Mobilization Senior Associate , Multiple positions"
1845,Kabul City,National,Health,Full Time,Any,2.5,BA,Position Title: Finance Officer
1846,West Zone,National,Security,Full Time,Any,1.5,HS,Position Title: Watchman
1847,South Zone,National,Health,Full Time,Female,3.5,MD,Position Title: GYN/OBs Surgeon
1848,Kabul City,National,Education,Full Time,Male,7.0,MA,Position Title: Program Manager (Re Announced) (Re Announced)
1849,West Zone,National,Security,Full Time,Any,1.5,HS,Position Title: Watchman
1850,East Zone,National,Security,Full Time,Any,1.5,HS,Position Title: Watchman
1851,Kabul City,National,Education,Full Time,Male,6.5,MA,Position Title: Education Program Manager (Re Announced)
1852,Kabul Zone,National,Education,Full Time,Male,2.0,BA,Position Title: Admin/Finance Officer (Re Announced) (Re Announced)
1853,East Zone,National,Security,Full Time,Any,1.5,HS,Position Title: Watchman
1854,North-East Zone,National,Education,Full Time,Male,2.0,BA,Position Title: Admin/Finance Officer (Re Announced)
1855,South Zone,National,Health,Full Time,Male,5.5,MD,Position Title: Head of Surgical Department.
1856,East Zone,National,Security,Full Time,Any,1.5,HS,Position Title: Watchman
1857,Kabul Zone,National,Business,Full Time,Any,3.0,MA,Position Title: PMEAL Officer
1858,South Zone,National,Health,Full Time,Male,3.5,BA,Position Title: Nursing Director.
1859,South Zone,National,Health,Full Time,Male,2.5,VD,Position Title: Pharmacy Technician.
1860,Kabul Zone,National,Business,Full Time,Female,2.0,BA,Position Title: Community Mobilizer (Re Announced)
1861,Kabul City,National,Business,Full Time,Male,5.0,BA,Position Title: Finance Manager (Re Announced)
1862,Kabul City,National,Education,Full Time,Male,5.0,BA,Position Title: Project Officer (Re Announced)
1863,West Zone,National,Health,Full Time,Male,5.0,MD,Position Title: Provincial Officer
1864,Kabul City,International,Engineering,Full Time,Any,7.0,MA,Position Title: Senior Project Manager
1865,North-Zone,National,Business,Full Time,Any,5.0,BA,Position Title: National Engineer
1866,Kabul City,National,Business,Full Time,Any,6.0,SS,"Position Title: Finance Associate, Multiple positions"
1867,West Zone,National,Health,Full Time,Male,3.0,MD,Position Title: Senior Technical Officer (Re Announced)
1868,Kabul City,National,Business,Full Time,Any,7.0,BA,Position Title: MARKETING MANAGER
1869,East Zone,National,Business,Full Time,Any,4.0,BA,Position Title: Project Manager (Child Protection)
1870,East Zone,National,Business,Full Time,Any,4.0,BA,Position Title: Psycho Social Support (PSS) Counsellor
1871,East Zone,National,Others,Full Time,Any,4.0,BA,Position Title: Case Management Officer
1872,Kabul City,Any,Education,Part Time,Any,2.0,BA,"Position Title: School Teachers, Cambridge Subjects (Computer, Chemistry, Mathematics, Biology, Physics, English) Headmistress & Cambridge Computer Teacher(Balkh)"
1873,North-Zone,National,Business,Full Time,Any,5.0,MA,Position Title: Operations Manager (Re Announced) (Re Announced)
1874,North-Zone,National,Others,Full Time,Any,2.0,BA,Position Title: Quantitative Survey Enumerator
1875,North-Zone,National,Others,Full Time,Any,2.0,BA,Position Title: Qualitative Survey Enumerator
1876,Kabul City,National,IT,Full Time,Any,2.0,BA,Position Title: ICT Officer (Re Announced)
1877,Kabul City,National,Others,Full Time,Any,1.0,HS,Position Title: Data Clerk (Quantitative and Qualitative)
1878,East Zone,National,Health,Full Time,Any,3.0,MD,Position Title: Medical Doctor
1879,Kabul City,National,IT,Full Time,Any,5.0,MA,Position Title: Information Manager
1880,Kabul City,National,Health,Full Time,Any,2.0,MD,Position Title: Medical Doctor PD13
1881,East Zone,National,Business,Full Time,Female,2.0,SS,Position Title: IYCF Counsellor (Female Only)
1882,East Zone,National,Business,Full Time,Female,2.0,SS,Position Title: IYCF Counsellor (Female Only)
1883,Kabul City,National,Business,Full Time,Male,8.0,BA,Position Title: Admin Finance Manager
1884,Kabul City,National,Health,Part Time,Any,6.0,MA,"Position Title: Gynecologist, ultrasonologist"
1885,Kabul City,Any,Health,Full Time,Male,2.0,MA,Position Title: General Physician Specialist
1886,Kabul City,National,Business,Full Time,Male,4.0,BA,Position Title: Accounting Supervisor
1887,East Zone,National,Health,Full Time,Any,2.5,BA,Position Title: Orthopedic Surgeon (Share-based)
1888,South Zone,National,Others,Full Time,Male,2.0,BA,Position Title: Lecturers for  Computer Science Faculty
1889,Kabul City,National,Engineering,Full Time,Male,7.0,BA,Position Title: Proposal Writer ( Civil Engineer )
1890,West Zone,National,Business,Full Time,Any,3.0,BA,Position Title: Digital Marketer (Herat Local Recruitment)
1891,Kabul City,National,Business,Full Time,Any,4.0,BA,Position Title: Last Mile Assurance Officer
1892,Kabul City,National,Others,Full Time,Any,7.0,BA,Position Title: Event Manager
1893,Kabul City,National,Others,Full Time,Male,4.5,BA,Position Title: Marketing Manager
1894,North-East Zone,National,Health,Full Time,Female,1.0,MD,Position Title: Gynecologist (Re Announced)
1895,South Zone,National,Health,Full Time,Female,2.0,BA,Position Title: Midwife Activity Manager (Re Announced)
1896,Kabul City,National,Health,Full Time,Any,3.0,BA,Position Title: Dermatologist
1897,Kabul City,Any,Others,Part Time,Any,2.0,BA,Position Title: Marketing Manager
1898,Kabul City,National,Business,Full Time,Any,6.0,BA,Position Title: Finance and Admin Manager
1899,Kabul City,National,Security,Full Time,Male,4.0,HS,Position Title: Security Officer
1900,North-East Zone,National,Education,Full Time,Any,1.0,BA,Position Title: Data Collectors (couples)
1901,Kabul City,National,Business,Full Time,Male,3.5,BA,Position Title: Field Manager
1902,Kabul City,National,Business,Full Time,Male,0.0,BA,Position Title: Internal Audit Officer
1903,West Zone,National,Engineering,Full Time,Any,6.0,BA,Position Title: Project Manager
1904,West Zone,National,Engineering,Full Time,Any,5.0,BA,Position Title: Quality Assurance / Quality Control Engineer
1905,Kabul City,National,Legal,Full Time,Male,3.0,MA,Position Title: Associate Attorney
1906,West Zone,National,Business,Full Time,Male,2.5,BA,Position Title: Islamic Investment Officer
1907,East Zone,National,Education,Full Time,Male,3.0,BA,Position Title: Lecturer for HRM and Finance Subjects-Faculty of Economics
1908,Kabul City,National,Security,Full Time,Male,5.0,BA,Position Title: HR Manager
1909,Kabul City,National,Security,Full Time,Male,5.0,BA,Position Title: Proposal Writer for Security Company
1910,Kabul City,National,Business,Full Time,Male,5.0,BA,"Position Title: HR & RSM (Recruitment, selection & Matriculation) Manager"
1911,Kabul City,National,Others,Full Time,Male,3.0,BA,Position Title: Admin Assistant for wash unit
1912,Kabul City,National,Business,Full Time,Any,5.0,BA,Position Title: Program Manager
1913,Kabul City,National,Education,Full Time,Female,3.5,BA,Position Title: Marketing Officer and Study Visa Filling Officer (Female)
1914,North-Zone,National,Engineering,Full Time,Any,10.0,BA,Position Title: Building Supervision Engineer
1915,North-East Zone,National,Education,Full Time,Any,4.0,BA,Position Title: Master Trainer
1916,North-East Zone,National,Education,Full Time,Any,4.0,HS,Position Title: Community Mobilizer
1917,North-East Zone,National,Education,Full Time,Any,4.0,HS,Position Title: Community Mobilizer
1918,North-East Zone,National,Education,Full Time,Any,4.0,HS,Position Title: Community Mobilizer
1919,North-East Zone,National,Education,Full Time,Any,4.0,BA,Position Title: Master Trainer
1920,Kabul City,National,Education,Full Time,Male,2.0,MA,Position Title: Lecturership BCS & BBA
1921,Kabul City,National,Education,Full Time,Male,10.0,MA,Position Title: University Chancellor
1922,Kabul City,National,Others,Full Time,Male,7.0,BA,Position Title: Quantity Survey Engineer
1923,Kabul City,National,Others,Full Time,Male,5.0,BA,Position Title: Guest House Manager and Events Coordinator
1924,Kabul City,National,IT,Full Time,Any,2.0,BA,Position Title: Application Developer
1925,Kabul City,National,Business,Full Time,Any,0.0,BA,"Position Title: Director, Human Resources"
1926,Kabul City,National,Others,Full Time,Any,7.0,BA,"Position Title: Specialist , HVC segment"
1927,Kabul City,National,Business,Full Time,Any,7.0,BA,Position Title: National Senior Procurement Specialist
1928,Kabul City,National,Business,Full Time,Any,7.0,BA,Position Title: National Senior Procurement Specialist - WERP Project
1929,Kabul City,National,Business,Full Time,Any,5.0,BA,Position Title: Sr. Database Manager and M&E Specialist
1930,Kabul City,National,Health,Full Time,Any,2.5,BA,Position Title: Finance Officer
1931,East Zone,National,Security,Full Time,Any,1.5,HS,Position Title: Watchman
1932,East Zone,National,Security,Full Time,Any,1.5,HS,Position Title: Watchman
1933,East Zone,National,Security,Full Time,Any,1.5,HS,Position Title: Watchman
1934,West Zone,National,Health,Full Time,Male,5.0,MD,Position Title: Provincial Officer
1935,Kabul City,National,Business,Full Time,Any,7.0,BA,Position Title: MARKETING MANAGER
1936,East Zone,National,Business,Full Time,Any,4.0,BA,Position Title: Project Manager (Child Protection)
1937,East Zone,National,Business,Full Time,Any,4.0,BA,Position Title: Psycho Social Support (PSS) Counsellor
1938,East Zone,National,Others,Full Time,Any,4.0,BA,Position Title: Case Management Officer
1939,Kabul City,Any,Education,Part Time,Any,2.0,BA,"Position Title: School Teachers, Cambridge Subjects (Computer, Chemistry, Mathematics, Biology, Physics, English) Headmistress & Cambridge Computer Teacher(Balkh)"
1940,Kabul City,National,IT,Full Time,Any,2.0,BA,Position Title: ICT Officer (Re Announced)
1941,Kabul City,National,Education,Full Time,Any,1.0,HS,Position Title: Data Clerk (Quantitative and Qualitative)
1942,West Zone,National,Business,Full Time,Any,4.0,,Position Title: Senior Programme Associate (In replacement Capacity with Lien)
1943,Central Highlands,National,Health,Full Time,Any,3.0,BA,Position Title: Pharmacy Officer
1944,Kabul Zone,National,Business,Full Time,Any,3.0,MA,Position Title: PMEAL Officer
1945,East Zone,National,Education,Full Time,Male,2.0,BA,Position Title: The Results Manager
1946,East Zone,National,Business,Full Time,Any,7.0,MA,Position Title: Senior TB Advisor
1947,Kabul City,Any,Business,Full Time,Male,5.0,MA,Position Title: Deputy Director Operations
1948,Kabul City,National,Business,Full Time,Male,10.0,MA,Position Title: Hiring of General Manager for Paaeez Continental
1949,North-Zone,National,Health,Full Time,Any,5.0,MD,Position Title: project manager
1950,North-Zone,National,Business,Full Time,Any,3.0,BA,Position Title: Admin/Finance Officer
1951,Kabul City,National,Others,Full Time,Any,6.0,MA,Position Title: Internal Audit Senior Officer
1952,Kabul City,National,Business,Full Time,Any,5.0,MA,Position Title: Finance Coordinator (Treasury) Re-Announced (Re Announced)
1953,North-Zone,National,Health,Full Time,Any,3.0,BA,Position Title: Participants representative
1954,Central Highlands,National,Security,Full Time,Male,5.0,BA,Position Title: Project Risk Manager  (PRM)
1955,East Zone,National,Business,Full Time,Any,0.0,BA,Position Title: Economic Recovery Officer (Engineer) (Re Announced)
1956,South Zone,National,Business,Full Time,Any,2.0,BA,Position Title: ICLA Technical Assistant
1957,Kabul City,National,Health,Full Time,Any,10.0,BA,Position Title: Procurement Manager
1958,Central Highlands,National,Business,Full Time,Female,2.0,BA,Position Title: Protection Psychosocial Support Officer (Female Only) (168802)
1959,West Zone,National,Others,Full Time,Any,3.0,BA,Position Title: Sales Executive
1960,Central Highlands,National,Business,Full Time,Female,2.0,BA,Position Title: Protection Officer ?caseworker? Ghazni (Female Only)
1961,Kabul City,National,Business,Full Time,Female,2.0,BA,Position Title: Protection Officer ?Case Worker? (Female Only) (168806)
1962,South Zone,National,Business,Full Time,Any,4.0,BA,Position Title: Finance Officer-UZG
1963,Central Highlands,National,Others,Full Time,Any,2.0,BA,Position Title: Hygiene promotor
1964,East Zone,National,Others,Full Time,Any,5.0,BA,Position Title: Project Officer
1965,East Zone,National,Others,Full Time,Any,2.0,BA,Position Title: Admin & Finance Assistant
1966,West Zone,National,Business,Full Time,Any,2.0,BA,Position Title: Logistic Officer FRH
1967,Central Highlands,National,Others,Full Time,Any,2.0,BA,Position Title: Admin & Procurement Assistant
1968,North-Zone,National,Others,Full Time,Any,0.0,BA,Position Title: Human Resource Officer
1969,Kabul City,National,Business,Full Time,Any,7.0,BA,Position Title: Senior Program Specialist
1970,North-Zone,National,Health,Full Time,Any,3.5,BA,Position Title: Project Monitoring Officer
1971,Kabul City,National,Business,Full Time,Any,4.0,MA,Position Title: Lobby & Advocacy Expert
1972,Kabul City,National,Agriculture,Full Time,Any,15.0,BA,Position Title: Deputy Chief of Party-Technical (Re Announced)
1973,Kabul City,National,Business,Full Time,Any,6.0,BA,Position Title: Finance Director
1974,North-Zone,National,Business,Full Time,Any,2.0,BA,Position Title: Finance Assistant
1975,Kabul City,National,Business,Full Time,Any,5.0,BA,Position Title: Communication Specialist
1976,Kabul City,Any,Business,Full Time,Any,0.0,BA,Position Title: Project Manager
1977,Kabul City,National,Business,Full Time,Any,3.0,BA,Position Title: District Coordinator
1978,Kabul City,National,Business,Full Time,Any,3.0,BA,Position Title: Community Development Facilitator (CDF)
1979,East Zone,National,Business,Full Time,Any,3.0,BA,Position Title: Trainer
1980,Kabul City,National,Education,Full Time,Any,7.5,MA,Position Title: Principal High School  
1981,North-Zone,Any,Education,Part Time,Any,2.0,BA,"Position Title: School Teachers, Cambridge Subject: (Computer), Maref Subjects:(History, Geography) Maref subject:(Dari :for Kabul location)"
1982,Kabul City,National,Business,Full Time,Any,5.0,MA,Position Title: Deputy Research Manager
1983,Kabul City,National,Others,Full Time,Any,3.0,MA,Position Title: Aviation Officer (NOB)- UNHAS- Kabul
1984,South Zone,National,Engineering,Full Time,Any,3.0,BA,Position Title: Site Engineer
1985,Kabul City,National,Others,Full Time,Any,1.0,MA,Position Title: Aviation Officer ( NOA)- UNHAS- Kabul
1986,Kabul Zone,National,Education,Full Time,Female,2.0,BA,Position Title: Master Trainer- Only Famele
1987,Kabul City,National,Business,Full Time,Any,5.0,BA,Position Title: Software Developer (Consultant) for developing WASH MIS (Afghan Nationals Only)
1988,Kabul City,National,Engineering,Full Time,Any,7.0,BA,Position Title: Project Manager (Re Announced)
1989,Kabul City,National,Business,Full Time,Any,5.0,BA,Position Title: Program Manager
1990,East Zone,National,Others,Full Time,Any,0.0,HS,"Position Title: POLITICAL AFFAIRS ASSISTANT, G5"
1991,Kabul City,National,Others,Full Time,Any,5.0,HS,"Position Title: ADMINISTRATIVE ASSISTANT, G5"
1992,West Zone,National,Health,Full Time,Male,2.5,BA,Position Title: Psychosocial Counselor
1993,Kabul City,National,Business,Full Time,Any,4.0,VD,Position Title: Administration Associate
1994,South Zone,National,Agriculture,Full Time,Male,4.0,BA,Position Title: Agriculture Specialist-Multiple
1995,Kabul Zone,National,Health,Full Time,Male,2.0,BA,Position Title: Surgeon Specialist  
1996,South Zone,National,Agriculture,Full Time,Male,4.0,BA,Position Title: Complaint Officer-Multiple
1997,West Zone,National,Others,Full Time,Any,2.0,BA,"Position Title: ASSISTANT ADMINISTRATIVE OFFICER, NOA"
1998,East Zone,National,Health,Full Time,Female,1.0,HS,Position Title: HSCs Health and Hygiene Promotor
1999,Kabul Zone,National,Business,Full Time,Male,5.0,MD,Position Title: Project provincial supervisor (Re Announced)
2000,South Zone,National,Agriculture,Full Time,Male,3.0,BA,Position Title: Extension Worker-Multiple
2001,Kabul City,National,Others,Full Time,Any,2.0,MD,Position Title: Nutrition Officer
2002,South Zone,National,Agriculture,Full Time,Male,2.5,BA,Position Title: Feedback and complaint mechanism officer-Multiple
2003,Kabul City,National,Others,Full Time,Female,2.0,BA,Position Title: Female Nutrition Nurse
2004,East Zone,National,Health,Full Time,Female,1.0,VD,Position Title: HSCs Female Nurse/Vaccinator
2005,North-East Zone,National,Engineering,Full Time,Any,4.0,BA,Position Title: Architecture and Design Engineer
2006,South Zone,National,Agriculture,Full Time,Female,3.0,BA,Position Title: Gender/PSEA Officer-Multiple
2007,North-East Zone,National,Business,Full Time,Any,4.0,BA,Position Title: Livestock Technical Officer
2008,North-East Zone,National,Business,Full Time,Any,3.0,BA,Position Title: Market Development Trainer
2009,South Zone,National,Agriculture,Full Time,Male,3.0,BA,Position Title: Livelihood Officer- Multiple
2010,Kabul City,National,Business,Full Time,Any,7.0,MA,Position Title: Senior Operations Officer
2011,South Zone,National,Others,Full Time,Any,2.0,BA,Position Title: Radio Operator (Re Announced)
2012,North-East Zone,National,Business,Full Time,Any,3.0,BA,Position Title: NRM Technical Assistant
2013,Central Highlands,National,Business,Full Time,Any,0.0,BA,Position Title: Regional Program Coordinator
2014,South Zone,National,Agriculture,Full Time,Male,2.0,BA,Position Title: Surveyor-Multiple
2015,Kabul City,National,IT,Full Time,Any,8.0,BA,Position Title: Senior Manager Transport (Transmission Planning)
2016,Kabul City,National,Business,Full Time,Female,5.0,MA,Position Title: Senior Finance Officer (Financial Reporting & Compliance)
2017,North-Zone,National,Business,Full Time,Any,2.0,BA,Position Title: Video Editing and Social Media Officer ? Remote Work
2018,North-Zone,National,Business,Full Time,Any,3.0,BA,Position Title: Construction Engineer
2019,Kabul City,National,Others,Full Time,Any,3.0,MA,Position Title: Health Coordinator
2020,North-Zone,National,Business,Full Time,Any,3.0,BA,Position Title: Market development Trainer
2021,North-Zone,National,Business,Full Time,Any,3.0,BA,Position Title: NRM & DRR Trainer
2022,North-Zone,National,Business,Full Time,Any,3.0,BA,Position Title: Agriculture and Livelihood Officer
2023,East Zone,National,Health,Full Time,Female,2.0,BA,Position Title: Female FATP Nurse (Only Paktia Residents)
2024,Central Highlands,National,Business,Full Time,Any,3.0,BA,Position Title: Admin & IT assistant
2025,Central Highlands,National,Business,Full Time,Any,3.0,BA,Position Title: Finance Assistant
2026,Central Highlands,National,Business,Full Time,Any,2.5,BA,Position Title: M&E Assistant
2027,North-Zone,National,Business,Full Time,Any,6.0,BA,Position Title: Operations Officer
2028,Central Highlands,National,Business,Full Time,Any,4.0,BA,Position Title: Agriculture and Livestock Officer
2029,Central Highlands,National,Business,Full Time,Any,3.0,BA,Position Title: Construction Site Engineer
2030,Central Highlands,National,Business,Full Time,Any,3.0,BA,Position Title: DRR Trainer
2031,Kabul City,National,Business,Full Time,Male,1.0,BA,Position Title: Counsellor
2032,Kabul City,National,Business,Full Time,Any,4.0,BA,Position Title: Project Manager
2033,East Zone,National,Business,Full Time,Any,3.0,HS,Position Title: Project Clerk (M&E)
2034,Kabul City,National,Business,Full Time,Any,4.0,BA,Position Title: Business Development Officer
2035,Kabul City,Any,Business,Full Time,Male,5.0,BA,Position Title: Assistant Manager Operations
2036,North-East Zone,National,Security,Full Time,Any,0.0,BA,Position Title: Security and Humanitarian Access Coordinator
2037,Central Highlands,National,Business,Full Time,Any,3.0,BA,Position Title: NRM Assistant
2038,Central Highlands,National,Business,Full Time,Any,1.0,HS,Position Title: Office Cleaner
2039,Central Highlands,National,Business,Full Time,Male,2.5,HS,Position Title: Security Guard
2040,Kabul City,National,Health,Full Time,Any,6.0,BA,Position Title: Midwifery Program Officer
2041,Kabul City,National,Business,Full Time,Male,4.0,BA,Position Title: AAM/Branch Manager (Re-Announced)
2042,Kabul City,National,Health,Full Time,Any,6.0,MD,Position Title: RMNH Officer
2043,North-Zone,National,Business,Full Time,Male,1.0,BA,Position Title: Teller Haritan Branch   
2044,West Zone,National,Health,Full Time,Any,4.0,MD,Position Title: Hospital Manager
2045,West Zone,National,Health,Full Time,Any,0.0,MD,Position Title: Pediatric Specialist
2046,Kabul City,National,Business,Full Time,Female,7.0,BA,Position Title: Programme Development Manager/Proposal Writer
2047,West Zone,National,Business,Full Time,Any,0.0,BA,Position Title: Gender and Youth Specialist
2048,Kabul City,National,Business,Full Time,Any,5.0,BA,Position Title: Human Resource Manager
2049,Kabul City,International,Others,Full Time,Any,5.0,MA,Position Title: WASH Cluster Co-Coordinator
2050,Kabul City,National,Others,Full Time,Any,2.5,BA,Position Title: Disability Specialist
2051,Kabul City,National,Business,Full Time,Male,2.5,BA,Position Title: Deputy IT Audit Manager (Re Announced)
2052,Kabul City,National,Business,Full Time,Any,5.0,BA,Position Title: Internal Auditor
2053,South Zone,National,Business,Full Time,Male,5.0,BA,Position Title: Admin & finance
2054,North-East Zone,National,Health,Full Time,Female,3.0,MD,Position Title: RH Supervisor
2055,North-East Zone,National,Health,Full Time,Male,3.0,MD,Position Title: HRD Officer
2056,North-Zone,National,Business,Full Time,Any,5.0,BA,Position Title: FSL Project Manager
2057,North-East Zone,National,Health,Full Time,Any,2.0,MD,Position Title: Cluster Supervisor
2058,Kabul City,National,Security,Full Time,Any,5.0,BA,Position Title: National Senior Security Officer - PIU
2059,North-Zone,National,Business,Full Time,Male,2.0,BA,Position Title: District Coordinator
2060,Kabul City,National,Engineering,Full Time,Any,7.0,BA,Position Title: National Senior Engineer - PIU
2061,East Zone,National,Business,Full Time,Female,0.0,BA,Position Title: District Communication Officer (DCO) - Only Female
2062,Kabul City,National,Others,Full Time,Any,7.0,BA,Position Title: National Senior Social Development Specialist - PIU
2063,Central Highlands,National,Health,Full Time,Any,2.5,BA,Position Title: IT Assistant
2064,Kabul City,National,Business,Full Time,Any,7.0,BA,Position Title: National Senior Finance Coordinator - PIU
2065,West Zone,National,Business,Full Time,Female,2.0,BA,Position Title: PSS Counselor (Psycho-Social Counselor)
2066,East Zone,National,Business,Full Time,Any,0.0,BA,Position Title: District Communication Officer (DCO) - Nangarhar (Behsud District)
2067,North-East Zone,National,Engineering,Full Time,Any,5.0,BA,Position Title: Site Engineer
2068,Kabul City,National,Business,Full Time,Any,0.0,BA,Position Title: Assistant Programme Officer (HIV Prevention and Drug Demand Reduction)
2069,Kabul City,National,Business,Full Time,Any,4.0,BA,Position Title: Community Mobilizer
2070,Kabul Zone,National,Engineering,Full Time,Male,5.0,BA,Position Title: Electrician
2071,Kabul City,National,Security,Full Time,Any,5.0,BA,"Position Title: Health, Safety and Security Coordinator"
2072,Kabul Zone,National,Others,Full Time,Male,5.0,HS,Position Title: Excavator Driver
2073,Kabul City,National,Education,Full Time,Any,4.0,BA,Position Title: Literacy and Numeracy Teacher
2074,Kabul City,National,Business,Full Time,Any,2.0,BA,Position Title: Supply Chain and Operations Assistant
2075,Kabul City,National,Business,Full Time,Any,2.5,BA,Position Title: HR Assistant
2076,Central Highlands,National,Security,Full Time,Male,0.0,HS,Position Title: Security Guard (Only Ghazni Residents)
2077,North-East Zone,National,Business,Full Time,Any,3.0,BA,Position Title: HR/Admin Officer
2078,Kabul City,National,Business,Full Time,Any,7.0,BA,Position Title: Reporting And Communication Manager
